root@intro-cyber-security-2021:~# tcpdump -c 5 -i eth0
tcpdump: verbose output suppressed, use -v or -vv for full protocol decode
listening on eth0, link-type EN10MB (Ethernet), capture size 262144 bytes
19:32:40.453216 IP 159.203.9.52.ssh > cpef81d0fa14323-cmf81d0fa14320.cpe.net.cable.rogers.com.61506: Flags [P.], seq 1516535080:1516535188, ack 2169764167, win 501, length 108
19:32:40.453337 IP 159.203.9.52.ssh > cpef81d0fa14323-cmf81d0fa14320.cpe.net.cable.rogers.com.61506: Flags [P.], seq 108:144, ack 1, win 501, length 36
19:32:40.453634 IP 159.203.9.52.ssh > cpef81d0fa14323-cmf81d0fa14320.cpe.net.cable.rogers.com.61506: Flags [P.], seq 144:252, ack 1, win 501, length 108
19:32:40.453707 IP 159.203.9.52.ssh > cpef81d0fa14323-cmf81d0fa14320.cpe.net.cable.rogers.com.61506: Flags [P.], seq 252:288, ack 1, win 501, length 36
19:32:40.454236 IP 159.203.9.52.39420 > dns.google.domain: 57530+ PTR? 118.244.119.174.in-addr.arpa. (46)
5 packets captured
15 packets received by filter
0 packets dropped by kernel
root@intro-cyber-security-2021:~#
